{
  "$schema": "http://json-schema.org/draft-03/schema",
  "required" : true,
  "type" : "object",
  "properties": {
    "id": { "required": true, "type": "number" },
    "name": { "required": true, "type": "string" },
    "domain": { "required": true, "type": "string" },
    "core_services_id": { "required": true, "type": "string" },
    "objects_amount_limit": { "required": true, "type": "number" },
    "owner_name": { "required": true, "type": "string" },
    "owner_email": { "required": true, "type": "string" },
    "owner_phone": { "required": true, "type": "string" },
    "current_amount": { "required": true, "type": "number" }
  }
}
